{
  "$schema": "http://json-schema.org/draft-04/schema#",
  "type": "object",
  "properties": {
    "id": {
      "type": "integer"
    },
    "title": {
      "type": "string"
    },
    "content": {
      "type": "string"
    },
    "createDate": {
      "type": "string"
    },
    "updateDate": {
      "type": "string"
    }
  },
  "required": [
    "id",
    "title",
    "content",
    "createDate",
    "updateDate"
  ]
}