 [
                {
                  "id": 101,
                  "title": "VP Reporting",
                  "content": "salls has been reported",
                  "createDate": "2015-07-04T21:00:00", 
                  "updateDate": "2015-07-04T21:00:00"
                },
                {
                  "id": 102,
                  "title": "CFO Reporting",
                  "content": "4th quarter report",
                  "createDate": "2015-07-04T21:00:00",
                  "updateDate": "2015-07-04T21:00:00"
                }
]
               